{
  "server_time": "2026-10-27T10:05:12.345Z",
  "cursor": "MjAyNi0xMC0yN1QxMDowNToxMi4zNDVaXzAxOWEyYjNjLTRkNWUtN2YwMC04YTAwLTAwMDAwMDAwMDAwOQ",
  "has_more": false,
  "changes": {
    "sites": [
      {
        "id": "019a2b3c-4d5e-7f00-8a00-000000000001",
        "name": "Telephely A",
        "address": "1051 Budapest, Példa utca 1.",
        "timezone": "Europe/Budapest",
        "no_data_alert_after_min": 120,
        "created_by": "019a2b3c-4d5e-7f00-8a00-000000000002",
        "created_at": "2026-10-20T08:00:00.000Z",
        "updated_at": "2026-10-27T10:05:12.345Z"
      }
    ],
    "users": [
      {
        "id": "019a2b3c-4d5e-7f00-8a00-000000000003",
        "name": "Kiss Péter",
        "role": "guard",
        "pin_hash": "q83vEjRWeJCrze8SNFZ4kKvN7xI0VniQq83vEjRWeJA=",
        "pin_salt": "q83vEjRWeJCrze8SNFZ4kA==",
        "pin_iterations": 100000,
        "active": true,
        "site_ids": [
          "019a2b3c-4d5e-7f00-8a00-000000000001"
        ],
        "created_at": "2026-10-20T08:00:00.000Z",
        "updated_at": "2026-10-27T10:05:12.345Z"
      }
    ],
    "devices": [],
    "checkpoints": [],
    "routes": [],
    "route_versions": [],
    "route_version_checkpoints": [],
    "schedules": [],
    "report_subscriptions": []
  },
  "deleted": {
    "sites": [],
    "users": [
      "019a2b3c-4d5e-7f00-8a00-000000000040"
    ],
    "devices": [],
    "checkpoints": [],
    "routes": [],
    "schedules": [],
    "report_subscriptions": []
  }
}
